{
  "schema": "bskel.internal.python-http-scope-record/0",
  "item": "HTTP-python-flask-01",
  "framework": "flask",
  "track": "T12",
  "claims": {
    "supported": false,
    "runtime_tested": false,
    "extraction": "partial-static",
    "statement": "Scope record, not a support claim. Static extraction is partial: only entries whose outcome is caught were observed extracted exactly on the recorded fixtures; the unsupported_gap entries are known silent omissions or wrong paths. A profile or catalog registration does not change this. Any later support statement is limited to the scope.supported entries, to the layers named in them, to the pinned framework version and to the registration state recorded here."
  },
  "runtime_tested": {
    "status": "BLOCKED",
    "reason": "Runtime-tested needs a request-level verifier (T16 / beval in the audit plan) that serves requests against a pinned install; none was run. This package only read the framework route table at import time, so every runtime or request claim stays BLOCKED."
  },
  "evidence_level": "oracle-compared",
  "registration": {
    "source": "adapters/http-wave-a/flask.mjs",
    "entry": {
      "id": "python-flask",
      "state": "candidate",
      "registration": "unregistered",
      "productionDefault": false,
      "runtimeTested": false,
      "t19Review": "NOT_REVIEWED"
    }
  },
  "layers": [
    {
      "id": "t06-flask-shadow",
      "source": "scanners/language/python/flask-shadow.mjs",
      "role": "T06 AST route shadow (buildFlaskRouteShadow) over the Python project facts"
    },
    {
      "id": "t12-flask-leaf",
      "source": "adapters/http-wave-a/flask.mjs",
      "role": "T12 leaf projection of the T06 shadow into explicit-method routes plus unknowns"
    }
  ],
  "fixtures": [
    {
      "id": "normal",
      "role": "normal",
      "files": {
        "app.py": "2149ef5cbf9ba6ae81b7de592d5e9d007ba652a5483147e87bb0875415d87b68"
      }
    },
    {
      "id": "counterexamples/default-methods",
      "role": "counterexample",
      "files": {
        "app.py": "4b109ae3b0f3542f43eedf0bb8583ac19ca83339587d22ac036e6af65d4df34f"
      }
    },
    {
      "id": "counterexamples/deployment-prefix",
      "role": "counterexample",
      "files": {
        "app.py": "e0a1f9f4f3f209bbcf7539204ee57d1f3f2783d0a66cdf1efe4ceb169fefaf42"
      }
    },
    {
      "id": "counterexamples/dynamic-route-factory",
      "role": "counterexample",
      "files": {
        "app.py": "ef4ca16bc852f2403d2c6e1d5a6a6947b6fd79fbf2a622b739c41d7472a7eeb3"
      }
    },
    {
      "id": "counterexamples/generated-routes",
      "role": "counterexample",
      "files": {
        "app.py": "dc526028389c8adcafa87364c8151152ba155688d6c58e991073931a74e2c2f1"
      }
    },
    {
      "id": "counterexamples/imperative-registration",
      "role": "counterexample",
      "files": {
        "app.py": "4e3c979cf1d375b85d8e8e66c46701eaa4346c58aedec94ffa8deed10e4d45b4"
      }
    },
    {
      "id": "counterexamples/middleware-auth",
      "role": "counterexample",
      "files": {
        "app.py": "d722540dd77a9bb17602a423291b31f93a8480e9409675689fcde0b2140fb94b"
      }
    },
    {
      "id": "counterexamples/router-prefix",
      "role": "counterexample",
      "files": {
        "app.py": "a486a676729a8fd36bfcb41c49c76f4bac260fefff9f067014c180d4630e86d3"
      }
    }
  ],
  "must_catch": [
    {
      "id": "normal-literal-routes",
      "construct": "literal @app.route/@app.get/@blueprint decorators: literal paths, a literal methods list, a Blueprint with a literal url_prefix and an int converter (the supported baseline)",
      "fixture": "normal",
      "minimal_counterexample": "app.py",
      "rule": "catch-or-flag",
      "expected": {
        "routes": [
          "DELETE /items/<int:item_id>",
          "GET /health",
          "GET /items/<int:item_id>",
          "POST /api/items"
        ],
        "generated": [
          "GET /static/<path:filename>"
        ]
      },
      "layers": {
        "t06-flask-shadow": {
          "outcome": "caught",
          "class": "exact",
          "missed": [],
          "extra": [],
          "unresolved": [],
          "generated_unseen": 1,
          "flags": [
            "registration-limitation"
          ],
          "covering_flags": []
        },
        "t12-flask-leaf": {
          "outcome": "caught",
          "class": "exact",
          "missed": [],
          "extra": [],
          "unresolved": [],
          "generated_unseen": 1,
          "flags": [],
          "covering_flags": []
        }
      }
    },
    {
      "id": "dynamic-route-factory",
      "construct": "routes whose paths come from a loop or factory call at import time (dynamic route factory)",
      "fixture": "counterexamples/dynamic-route-factory",
      "minimal_counterexample": "app.py",
      "rule": "catch-or-flag",
      "expected": {
        "routes": [
          "GET /alpha",
          "GET /beta"
        ],
        "generated": [
          "GET /static/<path:filename>"
        ]
      },
      "layers": {
        "t06-flask-shadow": {
          "outcome": "omitted-unflagged",
          "class": "incomplete",
          "missed": [
            "GET /alpha",
            "GET /beta"
          ],
          "extra": [],
          "unresolved": [],
          "generated_unseen": 1,
          "flags": [],
          "covering_flags": []
        },
        "t12-flask-leaf": {
          "outcome": "omitted-unflagged",
          "class": "incomplete",
          "missed": [
            "GET /alpha",
            "GET /beta"
          ],
          "extra": [],
          "unresolved": [],
          "generated_unseen": 1,
          "flags": [],
          "covering_flags": []
        }
      }
    },
    {
      "id": "imperative-registration",
      "construct": "routes registered with app.add_url_rule(...) instead of a decorator",
      "fixture": "counterexamples/imperative-registration",
      "minimal_counterexample": "app.py",
      "rule": "catch-or-flag",
      "expected": {
        "routes": [
          "GET /ping"
        ],
        "generated": [
          "GET /static/<path:filename>"
        ]
      },
      "layers": {
        "t06-flask-shadow": {
          "outcome": "omitted-unflagged",
          "class": "incomplete",
          "missed": [
            "GET /ping"
          ],
          "extra": [],
          "unresolved": [],
          "generated_unseen": 1,
          "flags": [],
          "covering_flags": []
        },
        "t12-flask-leaf": {
          "outcome": "omitted-unflagged",
          "class": "incomplete",
          "missed": [
            "GET /ping"
          ],
          "extra": [],
          "unresolved": [],
          "generated_unseen": 1,
          "flags": [],
          "covering_flags": []
        }
      }
    },
    {
      "id": "router-prefix",
      "construct": "Blueprint url_prefix overridden by register_blueprint(url_prefix=...) (router prefix composition)",
      "fixture": "counterexamples/router-prefix",
      "minimal_counterexample": "app.py",
      "rule": "catch-or-flag",
      "expected": {
        "routes": [
          "GET /v2/ping"
        ],
        "generated": [
          "GET /static/<path:filename>"
        ]
      },
      "layers": {
        "t06-flask-shadow": {
          "outcome": "flagged",
          "class": "wrong",
          "missed": [
            "GET /v2/ping"
          ],
          "extra": [
            "GET /api/ping"
          ],
          "unresolved": [],
          "generated_unseen": 1,
          "flags": [
            "registration-limitation"
          ],
          "covering_flags": [
            {
              "code": "registration-limitation",
              "text_includes": "url_prefix",
              "covers": "names the register_blueprint(url_prefix=...) override this fixture uses; the shadow reports the Blueprint prefix and says the override is not composed"
            }
          ]
        },
        "t12-flask-leaf": {
          "outcome": "wrong-unflagged",
          "class": "wrong",
          "missed": [
            "GET /v2/ping"
          ],
          "extra": [
            "GET /api/ping"
          ],
          "unresolved": [],
          "generated_unseen": 1,
          "flags": [],
          "covering_flags": []
        }
      }
    },
    {
      "id": "default-methods",
      "construct": "@app.route without methods= (framework default method semantics)",
      "fixture": "counterexamples/default-methods",
      "minimal_counterexample": "app.py",
      "rule": "catch-or-flag",
      "expected": {
        "routes": [
          "GET /ping"
        ],
        "generated": [
          "GET /static/<path:filename>"
        ]
      },
      "layers": {
        "t06-flask-shadow": {
          "outcome": "left-unknown",
          "class": "method-unresolved",
          "missed": [],
          "extra": [],
          "unresolved": [
            "- /ping"
          ],
          "generated_unseen": 1,
          "flags": [],
          "covering_flags": []
        },
        "t12-flask-leaf": {
          "outcome": "flagged",
          "class": "incomplete",
          "missed": [
            "GET /ping"
          ],
          "extra": [],
          "unresolved": [],
          "generated_unseen": 1,
          "flags": [
            "FLASK_METHOD_SEMANTICS_UNRESOLVED"
          ],
          "covering_flags": [
            {
              "code": "FLASK_METHOD_SEMANTICS_UNRESOLVED",
              "covers": "the leaf emits no route for a @route with default methods and records the unknown instead of guessing GET"
            }
          ]
        }
      }
    },
    {
      "id": "middleware-auth",
      "construct": "authentication enforced by an @app.before_request hook; the route table is identical with or without it",
      "fixture": "counterexamples/middleware-auth",
      "minimal_counterexample": "app.py",